doc;correct_sublabel;category;reasoning;subcategory;subcategory_reasoning;
Peripheral β-amyloid (Aβ), including those contained in the gut, may contribute to the formation of Aβ plaques in the brain, and gut microbiota appears to exert an impact on Alzheimer’s disease (AD) via the gut-brain axis, although detailed mechanisms are not clearly defined. The current study focused on uncovering the potential interactions among gut-derived Aβ in aging, gut microbiota, and AD pathogenesis. To achieve this goal, the expression levels of Aβ and several key proteins involved in Aβ metabolism were initially assessed in mouse gut, with key results confirmed in human tissue. The results demonstrated that a high level of Aβ was detected throughout the gut in both mice and human, and gut Aβ42 increased with age in wild type and mutant amyloid precursor protein/presenilin 1 (APP/PS1) mice. Next, the gut microbiome of mice was characterized by 16S rRNA sequencing, and we found the gut microbiome altered significantly in aged APP/PS1 mice and fecal microbiota transplantation (FMT) of aged APP/PS1 mice increased gut BACE1 and Aβ42 levels. Intra-intestinal injection of isotope or fluorescence labeled Aβ combined with vagotomy was also performed to investigate the transmission of Aβ from gut to brain. The data showed that, in aged mice, the gut Aβ42 was transported to the brain mainly via blood rather than the vagal nerve. Furthermore, FMT of APP/PS1 mice induced neuroinflammation, a phenotype that mimics early AD pathology. Taken together, this study suggests that the gut is likely a critical source of Aβ in the brain, and gut microbiota can further upregulate gut Aβ production, thereby potentially contributing to AD pathogenesis.;A7;A;The publication is about the potential interactions among gut-derived Aβ in aging, gut microbiota, and AD pathogenesis. It aims to understand the mechanisms underlying Alzheimer’s disease and its progression. Therefore, it falls under the category of Disease Mechanisms.;;;FALSCH
The aim of this study was to disentangle the effects of various genetic factors on hippocampal subfield volumes using three different approaches: a biologically drivencandidate gene approach, a hypothesis-free GWAS approach, and a polygenic approach, where AD risk alleles are combined with a polygenic risk score (PRS). The impact of these genetic factors was investigated in a large dementia-free general population cohort from the Study of Health in Pomerania (SHIP, n = 1806). Analyses were performed using linear regression models adjusted for biological and environmental risk factors. Hippocampus subfield volume alterations were found for APOE ε4, BDNF Val, and 5-HTTLPR L allele carriers. In addition, we were able to replicate GWAS findings, especially for rs17178139 (MSRB3), rs1861979 (DPP4), rs7873551 (ASTN2), and rs572246240 (MAST4). Interaction analyses between the significant SNPs as well as the PRS for AD revealed no significant results. Our results confirm that hippocampal volume reductions are influenced by genetic variation, and that different variants reveal different association patterns that can be linked to biological processes in neurodegeneration. Thus, this study underlines the importance of specific genetic analyses in the quest for acquiring deeper insights into the biology of hippocampal volume loss, memory impairment, depression, and neurodegenerative diseases.;A1a;A;The publication is focused on understanding the genetic basis of hippocampal volume loss in dementia-free individuals, which falls under the category of Disease Mechanisms.;A1;The abstract discusses the impact of genetic factors on hippocampal subfield volumes, including candidate gene approach, GWAS approach, and polygenic risk score. Therefore, the most relevant category is Genetics (A1).;FALSCH
BACKGROUND: Exposure to air pollution has been suggested to increase the risk of dementia, but studies on this link often lack a detailed screening for dementia and data on important confounders.OBJECTIVE: To determine the association of exposure to air pollution with the risk of dementia and cognitive decline in the population-based Rotterdam Study.METHODS: Between 2009 and 2010, we determined air pollutant concentrations at participants residential addresses using land use regression models. Determined air pollutants include particulate matter <10μm (PM10) and <2.5μm (PM2.5), a proxy of elemental carbon (PM2.5 absorbance), nitrogen oxide (NOx), and nitrogen dioxide (NO2). As the individual air pollutant levels were highly correlated (r = 0.71-0.98),we computed a general marker covering all air pollutants based on a principal component analysis. We followed participants up for dementia until 2018 anddetermined cognitive performance during two subsequent examination rounds. Using Cox and linear mixed models, we related air pollution to dementia and cognitive decline.RESULTS: Of the 7,511 non-demented participants at baseline, 545 developed dementia during a median follow-up of 7 years. The general marker of all air pollutants was not associated with the risk of dementia (hazard ratio [95% confidence interval]: 1.04 [0.95-1.15]), neither were the individual air pollutants. Also, the general marker of all air pollutants or the individual air pollutant levels were not associated with cognitive decline. CONCLUSION: In this study, we found no clear evidence for an association between exposure to air pollution and the risk of dementia or cognitive decline.;A10;F;The publication is not relevant to the topic of Alzheimer's disease as it focuses on the association between air pollution and the risk of dementia and cognitive decline.;A10;The abstract focuses on the association between exposure to air pollution and the risk of dementia and cognitive decline, which falls under the category of Epidemiological Studies.;1
"BACKGROUND: Tau positron emission tomography (PET) imaging enables longitudinal observation of tau accumulation in Alzheimer's disease (AD). 18F-MK6240 is a high affinity tracer for the paired helical filaments of tau in AD, widely used in clinical trials, despite sparse longitudinal natural history data. We aimed to evaluate the natural history of tau accumulation, and the impact of disease stage and reference region on the magnitude and effect size of regional change.METHODS: One hundred and eighty-four participants: 89 cognitively unimpaired (CU) beta-amyloid negative (Aβ-), 44 CU Aβ+, 51cognitively impaired Aβ+ (26 with mild cognitive impairment [MCI] and 25 with dementia) had follow-up 18F-MK6240 PET for one to four years (median 1.48). Regional standardised uptake value ratios (SUVR) were generated. Two reference regions were examined: cerebellar cortex and eroded subcortical white matter.FINDINGS: CU Aβ- participants had very low rates of tau accumulation in the mesial temporal lobe (MTL). In CU Aβ+, significantly higher rate of accumulation was seen in the MTL (particularly the amygdala), extending into the inferior temporal lobes. In MCI Aβ+, the rate of accumulation was greatest in the lateral temporal, parietal and lateral occipital cortex, and plateaued in the MTL. Accumulation was global in AD Aβ+, except for a plateau in the MTL. The eroded subcortical white matter reference region showed no significant advantage over the cerebellar cortex and appeared prone to spill-over in AD participants. Data fitting suggested approximately 15-20 years to accumulate tau to typical AD levels.INTERPRETATION: Tau accumulation occurs slowly. Rates vary according to brain region, disease stage and tend to plateau at high levels. Rates of tau accumulation are best measured in the MTL and inferior temporal cortex in preclinical AD and in large neocortical areas, in MCI and AD. FUNDING: NHMRC; Cerveau Technologies.";A6;A;The publication analyzes tau in Alzheimer's disease (AD) using PET imaging, which aims to understand the neuropathology and progression of AD.;A6;The abstract is about tau positron emission tomography (PET) imaging, which is a method to measure tau accumulation in Alzheimer's disease (AD). The study examines the natural history of tau accumulation, and the impact of disease stage and reference region on the magnitude and effect size of regional change.;1
Peripheral β-amyloid (Aβ), including those contained in the gut, may contribute to the formation of Aβ plaques in the brain, and gut microbiota appears to exert an impact on Alzheimer's disease (AD) via the gut-brain axis, although detailed mechanisms are not clearly defined. The current study focused on uncovering the potential interactions among gut-derived Aβ in aging, gut microbiota, and AD pathogenesis. To achieve this goal, the expression levels of Aβ and several key proteins involved in Aβ metabolism were initially assessed in mouse gut, with key results confirmed in human tissue. The results demonstrated that a high level of Aβ was detected throughout the gut in bothmice and human, and gut Aβ42increased with age in wild type and mutant amyloid precursor protein/presenilin 1 (APP/PS1) mice. Next, the gut microbiome of mice was characterized by 16S rRNA sequencing, and we found the gut microbiome altered significantly in aged APP/PS1 mice and fecal microbiota transplantation (FMT) of aged APP/PS1 mice increased gut BACE1 and Aβ42 levels. Intra-intestinal injection of isotope or fluorescence labeled Aβ combined with vagotomy was also performed to investigate the transmission of Aβ from gut to brain. The data showed that, in aged mice,  the gut Aβ42 was transported to the brain mainly via blood rather than the vagal nerve. Furthermore, FMT of APP/PS1 mice induced neuroinflammation, a phenotype that mimics early AD pathology. Taken together, this study suggests that the gut is likely a critical source of Aβ in the brain, and gut microbiota can further upregulate gut Aβ production, thereby potentially contributing to AD pathogenesis.;A7;A;The study investigates the potential interactions among gut-derived Aβ in aging, gut microbiota, and AD pathogenesis.;A7;The abstract is about the gut-brain axis, the peripheral immune system, and glial cells, which are topics covered in category A7.;1